{
  "schema_version": "1.0",
  "generated_at": "2026-10-22T06:44:58Z",
  "overall": "healthy",
  "sources": [
    {
      "source_id": "arxiv",
      "name": "arXiv",
      "category": "ai_research",
      "status": "healthy",
      "last_success": "2026-10-22T06:44:58Z",
      "last_attempt": "2026-10-22T06:44:58Z",
      "last_error": null,
      "item_count": 20,
      "response_time_ms": null,
      "success_rate_7d": null,
      "consecutive_failures": 0
    },
    {
      "source_id": "github",
      "name": "GitHub",
      "category": "opensource",
      "status": "healthy",
      "last_success": "2026-10-22T06:44:58Z",
      "last_attempt": "2026-10-22T06:44:58Z",
      "last_error": null,
      "item_count": 20,
      "response_time_ms": null,
      "success_rate_7d": null,
      "consecutive_failures": 0
    },
    {
      "source_id": "openai_blog",
      "name": "OpenAI Blog",
      "category": "ai_official",
      "status": "healthy",
      "last_success": "2026-10-22T06:44:58Z",
      "last_attempt": "2026-10-22T06:44:58Z",
      "last_error": null,
      "item_count": 20,
      "response_time_ms": null,
      "success_rate_7d": null,
      "consecutive_failures": 0
    }
  ]
}